{
  "id": 2,
  "name_arabic": "ورد الإمام النووي",
  "name_english": "Wird of Imam al-Nawawi",
  "author": "Imam al-Nawawi",
  "type": "wird",
  "sort_order": 20,
  "items": [
    {
      "dhikr": 2001
    },
    {
      "dhikr": 2040
    },
    {
      "dhikr": 2041
    },
    {
      "dhikr": 2042
    },
    {
      "dhikr": 2043
    },
    {
      "dhikr": 2041
    },
    {
      "dhikr": 2042
    },
    {
      "dhikr": 2044
    },
    {
      "dhikr": 2041
    },
    {
      "dhikr": 2042
    },
    {
      "dhikr": 2005
    },
    {
      "dhikr": 2006
    },
    {
      "dhikr": 2007
    },
    {
      "dhikr": 2008
    },
    {
      "dhikr": 2009
    },
    {
      "dhikr": 2010
    },
    {
      "dhikr": 2011
    },
    {
      "dhikr": 2012
    },
    {
      "dhikr": 2013
    },
    {
      "dhikr": 2014
    },
    {
      "dhikr": 2015
    },
    {
      "dhikr": 2014
    },
    {
      "dhikr": 2016
    },
    {
      "dhikr": 2017
    },
    {
      "dhikr": 2018
    },
    {
      "dhikr": 2019
    },
    {
      "dhikr": 2020
    },
    {
      "dhikr": 2021
    },
    {
      "dhikr": 2022
    },
    {
      "surah": 112,
      "count": 3
    },
    {
      "dhikr": 2023
    },
    {
      "dhikr": 2024
    },
    {
      "dhikr": 2025
    },
    {
      "dhikr": 2026
    },
    {
      "dhikr": 2027
    },
    {
      "dhikr": 2028
    },
    {
      "dhikr": 2029
    },
    {
      "dhikr": 2030
    },
    {
      "dhikr": 2031
    },
    {
      "dhikr": 2032
    },
    {
      "dhikr": 2033
    },
    {
      "dhikr": 2034
    },
    {
      "dhikr": 2035
    },
    {
      "ayah": "7:196"
    },
    {
      "ayah": "17:45-46"
    },
    {
      "ayah": "9:129",
      "count": 7
    },
    {
      "dhikr": 2036
    },
    {
      "dhikr": 2037
    },
    {
      "dhikr": 2038
    },
    {
      "dhikr": 2039
    }
  ]
}
