{
  "id": 25,
  "name_arabic": "دُعَاءُ النِّيَّةِ لِدَلَائِلِ الْخَيْرَاتِ",
  "name_english": "Dala'il al-Khayrat — Supplication of Intention",
  "description": "The intention for the salawat, made before reciting Dala'il al-Khayrat.",
  "author": "Imam Muhammad al-Jazuli",
  "type": "wird",
  "sort_order": 28,
  "series": {
    "name_english": "Dala'il al-Khayrat",
    "name_arabic": "دَلَائِلُ الْخَيْرَاتِ"
  },
  "items": [
    {
      "dhikr": 2001
    },
    {
      "dhikr": 28001
    },
    {
      "dhikr": 28002
    },
    {
      "dhikr": 28003
    }
  ]
}
