{
  "id": 20,
  "name_arabic": "الدُّعَاءُ النَّاصِرِيُّ",
  "name_english": "Dua al-Nasiri",
  "description": "The Prayer of the Oppressed of Imam Muhammad ibn Nasir al-Darʿi: seventy-one couplets pleading for relief from oppression, for the turning back of the plots of enemies, and for the welfare of the land, its scholars and its people.",
  "author": "Imam Muhammad ibn Nasir al-Darʿi",
  "type": "wird",
  "sort_order": 44,
  "items": [
    {
      "dhikr": 2001
    },
    {
      "dhikr": 21001
    },
    {
      "dhikr": 21002
    },
    {
      "dhikr": 21003
    },
    {
      "dhikr": 21004
    },
    {
      "dhikr": 21005
    },
    {
      "dhikr": 21006
    },
    {
      "dhikr": 21007
    },
    {
      "dhikr": 21008
    },
    {
      "dhikr": 21009
    },
    {
      "dhikr": 21010
    },
    {
      "dhikr": 21011
    },
    {
      "dhikr": 21012
    },
    {
      "dhikr": 21013
    },
    {
      "dhikr": 21014
    },
    {
      "dhikr": 21015
    },
    {
      "dhikr": 21016
    },
    {
      "dhikr": 21017
    },
    {
      "dhikr": 21018
    },
    {
      "dhikr": 21019
    },
    {
      "dhikr": 21020
    },
    {
      "dhikr": 21021
    },
    {
      "dhikr": 21022
    },
    {
      "dhikr": 21023
    },
    {
      "dhikr": 21024
    },
    {
      "dhikr": 21025
    },
    {
      "dhikr": 21026
    },
    {
      "dhikr": 21027
    },
    {
      "dhikr": 21028
    },
    {
      "dhikr": 21029
    },
    {
      "dhikr": 21030
    },
    {
      "dhikr": 21031
    },
    {
      "dhikr": 21032
    },
    {
      "dhikr": 21033
    },
    {
      "dhikr": 21034
    },
    {
      "dhikr": 21035
    },
    {
      "dhikr": 21036
    },
    {
      "dhikr": 21037
    },
    {
      "dhikr": 21038
    },
    {
      "dhikr": 21039
    },
    {
      "dhikr": 21040
    },
    {
      "dhikr": 21041
    },
    {
      "dhikr": 21042
    },
    {
      "dhikr": 21043
    },
    {
      "dhikr": 21044
    },
    {
      "dhikr": 21045
    },
    {
      "dhikr": 21046
    },
    {
      "dhikr": 21047
    },
    {
      "dhikr": 21048
    },
    {
      "dhikr": 21049
    },
    {
      "dhikr": 21050
    },
    {
      "dhikr": 21051
    },
    {
      "dhikr": 21052
    },
    {
      "dhikr": 21053
    },
    {
      "dhikr": 21054
    },
    {
      "dhikr": 21055
    },
    {
      "dhikr": 21056
    },
    {
      "dhikr": 21057
    },
    {
      "dhikr": 21058
    },
    {
      "dhikr": 21059
    },
    {
      "dhikr": 21060
    },
    {
      "dhikr": 21061
    },
    {
      "dhikr": 21062
    },
    {
      "dhikr": 21063
    },
    {
      "dhikr": 21064
    },
    {
      "dhikr": 21065
    },
    {
      "dhikr": 21066
    },
    {
      "dhikr": 21067
    },
    {
      "dhikr": 21068
    },
    {
      "dhikr": 21069
    },
    {
      "dhikr": 21070
    },
    {
      "dhikr": 21071
    }
  ]
}
