{
  "id": 15,
  "name_arabic": "دُعَاءُ خَتْمِ دَلَائِلِ الْخَيْرَاتِ",
  "name_english": "Dala'il al-Khayrat — Closing Supplication",
  "author": "Imam Muhammad al-Jazuli",
  "type": "wird",
  "sort_order": 36,
  "series": {
    "name_english": "Dala'il al-Khayrat",
    "name_arabic": "دَلَائِلُ الْخَيْرَاتِ"
  },
  "items": [
    {
      "dhikr": 17001
    },
    {
      "dhikr": 17002
    },
    {
      "dhikr": 17003
    },
    {
      "dhikr": 17004
    },
    {
      "dhikr": 17005
    },
    {
      "dhikr": 17006
    },
    {
      "dhikr": 17007
    },
    {
      "dhikr": 17008
    },
    {
      "dhikr": 17009
    },
    {
      "dhikr": 17010
    },
    {
      "dhikr": 17011
    },
    {
      "dhikr": 17012
    },
    {
      "dhikr": 17013
    }
  ]
}
