{
  "id": 7,
  "name_arabic": "حِزْبُ الْبَحْرِ",
  "name_english": "Hizb al-Bahr",
  "description": "The Litany of the Sea, taught by Imam Abu al-Hasan al-Shadhili and recited for protection, especially in travel.",
  "author": "Imam Abu al-Hasan al-Shadhili",
  "type": "wird",
  "sort_order": 30,
  "items": [
    { "dhikr": 2001 },
    { "dhikr": 7002 },
    { "dhikr": 7003 },
    { "dhikr": 7004 },
    { "dhikr": 7005 },
    { "dhikr": 7006 },
    { "ayah": "19:1", "count": 3 },
    { "dhikr": 7007 },
    { "dhikr": 7008 },
    { "dhikr": 7009 },
    { "ayah": "36:66-67" },
    { "ayah": "36:1-9" },
    { "dhikr": 7010 },
    { "ayah": "20:111" },
    { "dhikr": 7011 },
    { "ayah": "55:19-20" },
    { "dhikr": 7012 },
    { "dhikr": 7013 },
    { "ayah": "40:1-3" },
    { "dhikr": 7014 },
    { "dhikr": 7015 },
    { "dhikr": 7016 },
    { "dhikr": 7017 },
    { "dhikr": 7018 },
    { "dhikr": 7019 },
    { "dhikr": 7020 },
    { "ayah": "85:20-22" },
    { "dhikr": 7021 },
    { "ayah": "7:196", "count": 3 },
    { "dhikr": 3013, "count": 3 },
    { "dhikr": 2011 },
    { "dhikr": 3016, "count": 3 },
    { "dhikr": 2036 },
    { "dhikr": 2037 }
  ]
}
