{
  "id": 8,
  "name_arabic": "الْحِزْبُ الثَّانِي مِنَ الْأَحْزَابِ السَّبْعَةِ",
  "name_english": "Dala'il al-Khayrat — Part 2 (Tuesday)",
  "author": "Imam Muhammad al-Jazuli",
  "type": "wird",
  "sort_order": 30,
  "series": {
    "name_english": "Dala'il al-Khayrat",
    "name_arabic": "دَلَائِلُ الْخَيْرَاتِ",
    "weekday": 2
  },
  "items": [
    {
      "dhikr": 11001
    },
    {
      "dhikr": 11002
    },
    {
      "dhikr": 11003
    },
    {
      "dhikr": 11004
    },
    {
      "dhikr": 11005
    },
    {
      "dhikr": 11006
    },
    {
      "dhikr": 11007
    },
    {
      "dhikr": 11008
    },
    {
      "dhikr": 11009
    },
    {
      "dhikr": 11010
    },
    {
      "dhikr": 11011
    },
    {
      "dhikr": 11012
    },
    {
      "dhikr": 11013
    },
    {
      "dhikr": 11014
    },
    {
      "dhikr": 11015
    },
    {
      "dhikr": 11016
    },
    {
      "dhikr": 11017
    },
    {
      "dhikr": 11018
    },
    {
      "dhikr": 11019
    },
    {
      "dhikr": 11020
    },
    {
      "dhikr": 11021
    },
    {
      "dhikr": 11022
    },
    {
      "dhikr": 11023
    },
    {
      "dhikr": 11024
    },
    {
      "dhikr": 11025
    },
    {
      "dhikr": 11026
    },
    {
      "dhikr": 11027
    },
    {
      "dhikr": 11028
    },
    {
      "dhikr": 11029
    },
    {
      "dhikr": 11030
    },
    {
      "dhikr": 11031
    },
    {
      "dhikr": 11032
    },
    {
      "dhikr": 11033
    },
    {
      "dhikr": 11034
    },
    {
      "dhikr": 11035
    },
    {
      "dhikr": 11036
    },
    {
      "dhikr": 11037
    },
    {
      "dhikr": 11038
    },
    {
      "dhikr": 11039
    },
    {
      "dhikr": 11040
    },
    {
      "dhikr": 11041
    },
    {
      "dhikr": 11042
    },
    {
      "dhikr": 11043
    },
    {
      "dhikr": 11044
    },
    {
      "dhikr": 11045
    },
    {
      "dhikr": 11046
    },
    {
      "dhikr": 11047
    },
    {
      "dhikr": 11048
    },
    {
      "dhikr": 11049
    },
    {
      "dhikr": 11050
    },
    {
      "dhikr": 11051
    },
    {
      "dhikr": 11052
    },
    {
      "dhikr": 11053
    },
    {
      "dhikr": 11054
    },
    {
      "dhikr": 11055
    },
    {
      "dhikr": 11056
    },
    {
      "dhikr": 11057
    },
    {
      "dhikr": 11058
    },
    {
      "dhikr": 11059
    },
    {
      "dhikr": 11060
    },
    {
      "dhikr": 11061
    },
    {
      "dhikr": 11062
    },
    {
      "dhikr": 11063
    },
    {
      "dhikr": 11064
    },
    {
      "dhikr": 11065
    },
    {
      "dhikr": 11066
    },
    {
      "dhikr": 11067
    },
    {
      "dhikr": 11068
    },
    {
      "dhikr": 11069
    },
    {
      "dhikr": 11070
    },
    {
      "dhikr": 11071
    },
    {
      "dhikr": 11072
    },
    {
      "dhikr": 11073
    },
    {
      "dhikr": 11074
    },
    {
      "dhikr": 11075
    },
    {
      "dhikr": 11076
    },
    {
      "dhikr": 11077
    },
    {
      "dhikr": 11078
    },
    {
      "dhikr": 11079
    },
    {
      "dhikr": 11080
    },
    {
      "dhikr": 11081
    },
    {
      "dhikr": 11082
    },
    {
      "dhikr": 11083
    },
    {
      "dhikr": 11084
    },
    {
      "dhikr": 11085
    },
    {
      "dhikr": 11086
    },
    {
      "dhikr": 11087
    },
    {
      "dhikr": 11088
    },
    {
      "dhikr": 11089
    },
    {
      "dhikr": 11090
    },
    {
      "dhikr": 11091
    },
    {
      "dhikr": 11092
    },
    {
      "dhikr": 11093
    },
    {
      "dhikr": 11094
    },
    {
      "dhikr": 11095
    },
    {
      "dhikr": 11096
    },
    {
      "dhikr": 11097
    },
    {
      "dhikr": 11098
    },
    {
      "dhikr": 11099
    },
    {
      "dhikr": 11100
    },
    {
      "dhikr": 11101
    },
    {
      "dhikr": 11102
    },
    {
      "dhikr": 11103
    },
    {
      "dhikr": 11104
    },
    {
      "dhikr": 11105
    },
    {
      "dhikr": 11106
    },
    {
      "dhikr": 11107
    },
    {
      "dhikr": 11108
    },
    {
      "dhikr": 11109
    },
    {
      "dhikr": 11110
    },
    {
      "dhikr": 11111
    },
    {
      "dhikr": 11112
    },
    {
      "dhikr": 11113
    },
    {
      "dhikr": 11114
    },
    {
      "dhikr": 11115
    },
    {
      "dhikr": 11116
    },
    {
      "dhikr": 11117
    },
    {
      "dhikr": 11118
    },
    {
      "dhikr": 11119
    },
    {
      "dhikr": 11120
    },
    {
      "dhikr": 11121
    },
    {
      "dhikr": 11122
    },
    {
      "dhikr": 11123
    },
    {
      "dhikr": 11124
    },
    {
      "dhikr": 11125
    },
    {
      "dhikr": 11126
    },
    {
      "dhikr": 11127
    },
    {
      "dhikr": 11128
    },
    {
      "dhikr": 11129
    },
    {
      "dhikr": 11130,
      "note": "Beginning of the Second Quarter of the hizb."
    },
    {
      "dhikr": 11131
    },
    {
      "dhikr": 11132
    },
    {
      "dhikr": 11133
    },
    {
      "dhikr": 11134
    },
    {
      "dhikr": 11135
    },
    {
      "dhikr": 11136
    },
    {
      "dhikr": 11137
    },
    {
      "dhikr": 11138
    },
    {
      "dhikr": 11139
    },
    {
      "dhikr": 11140
    }
  ]
}
