{
  "id": 14,
  "name_arabic": "الْحِزْبُ السَّابِعُ مِنَ الْأَحْزَابِ السَّبْعَةِ",
  "name_english": "Dala'il al-Khayrat — Part 7 (Sunday)",
  "author": "Imam Muhammad al-Jazuli",
  "type": "wird",
  "sort_order": 35,
  "series": {
    "name_english": "Dala'il al-Khayrat",
    "name_arabic": "دَلَائِلُ الْخَيْرَاتِ",
    "weekday": 7
  },
  "items": [
    {
      "dhikr": 16001
    },
    {
      "dhikr": 16002
    },
    {
      "dhikr": 16003
    },
    {
      "dhikr": 16004
    },
    {
      "dhikr": 16005
    },
    {
      "dhikr": 16006
    },
    {
      "dhikr": 16007
    },
    {
      "dhikr": 16008
    },
    {
      "dhikr": 16009
    },
    {
      "dhikr": 16010
    },
    {
      "dhikr": 16011
    },
    {
      "dhikr": 16012
    },
    {
      "dhikr": 16013
    },
    {
      "dhikr": 16014
    },
    {
      "dhikr": 16015
    },
    {
      "dhikr": 16016
    },
    {
      "dhikr": 16017
    },
    {
      "dhikr": 16018
    },
    {
      "dhikr": 16019
    },
    {
      "dhikr": 16020
    },
    {
      "dhikr": 16021
    },
    {
      "dhikr": 16022
    },
    {
      "dhikr": 16023
    }
  ]
}
