{
  "id": 19,
  "name_arabic": "حِزْبُ النَّصْرِ",
  "name_english": "Hizb al-Nasr (al-Shadhili)",
  "description": "The Litany of Victory of Imam Abu al-Hasan al-Shadhili: a plea for rescue and for the undoing of the plots of enemies, closing on the prophets whose supplications were answered.",
  "author": "Imam Abu al-Hasan al-Shadhili",
  "type": "wird",
  "sort_order": 43,
  "items": [
    {
      "dhikr": 2001
    },
    {
      "dhikr": 20001
    },
    {
      "dhikr": 20002
    },
    {
      "dhikr": 20003
    },
    {
      "dhikr": 20004
    },
    {
      "dhikr": 20005
    },
    {
      "dhikr": 20006
    },
    {
      "dhikr": 20007
    },
    {
      "dhikr": 20008
    },
    {
      "dhikr": 20009
    },
    {
      "dhikr": 20010
    },
    {
      "dhikr": 20011
    },
    {
      "dhikr": 20012
    },
    {
      "dhikr": 20013
    },
    {
      "dhikr": 7012
    },
    {
      "dhikr": 20014
    },
    {
      "dhikr": 20015
    },
    {
      "dhikr": 20016
    },
    {
      "dhikr": 20017
    },
    {
      "dhikr": 20018
    },
    {
      "dhikr": 20019
    },
    {
      "dhikr": 20020
    },
    {
      "dhikr": 20021
    },
    {
      "dhikr": 20022
    },
    {
      "dhikr": 20023
    },
    {
      "dhikr": 20024
    },
    {
      "dhikr": 20025
    },
    {
      "dhikr": 20026
    },
    {
      "dhikr": 20027
    },
    {
      "dhikr": 20028
    },
    {
      "dhikr": 20029
    },
    {
      "dhikr": 20030
    },
    {
      "dhikr": 20031
    },
    {
      "dhikr": 20032
    },
    {
      "dhikr": 20033
    },
    {
      "dhikr": 20034
    },
    {
      "dhikr": 20035
    },
    {
      "dhikr": 20036
    },
    {
      "dhikr": 20037
    },
    {
      "dhikr": 2034
    },
    {
      "dhikr": 2036,
      "count": 1
    },
    {
      "dhikr": 20038
    },
    {
      "dhikr": 20039
    },
    {
      "ayah": "6:45"
    }
  ]
}
