{
  "id": 13,
  "name_arabic": "الْحِزْبُ السَّادِسُ مِنَ الْأَحْزَابِ السَّبْعَةِ",
  "name_english": "Dala'il al-Khayrat — Part 6 (Saturday)",
  "author": "Imam Muhammad al-Jazuli",
  "type": "wird",
  "sort_order": 34,
  "series": {
    "name_english": "Dala'il al-Khayrat",
    "name_arabic": "دَلَائِلُ الْخَيْرَاتِ",
    "weekday": 6
  },
  "items": [
    {
      "dhikr": 15001
    },
    {
      "dhikr": 15002
    },
    {
      "dhikr": 15003
    },
    {
      "dhikr": 15004
    },
    {
      "dhikr": 15005
    },
    {
      "dhikr": 15006,
      "note": "Beginning of the Final Third of the hizb."
    },
    {
      "dhikr": 15007
    },
    {
      "dhikr": 15008
    },
    {
      "dhikr": 15009
    },
    {
      "dhikr": 15010
    },
    {
      "dhikr": 15011
    },
    {
      "dhikr": 15012
    },
    {
      "dhikr": 15013
    },
    {
      "dhikr": 15014
    },
    {
      "dhikr": 15015
    },
    {
      "dhikr": 15016
    },
    {
      "dhikr": 13017
    },
    {
      "dhikr": 15017
    },
    {
      "dhikr": 15018
    },
    {
      "dhikr": 15019,
      "note": "Beginning of the Fourth Quarter of the hizb."
    },
    {
      "dhikr": 15020
    }
  ]
}
