{
  "id": 6,
  "name_arabic": "الورد اللطيف (المساء)",
  "name_english": "al-Wird al-Latif (evening)",
  "description": "The daily wird of Imam al-Haddad, said each evening after maghrib. Its morning counterpart is a separate collection.",
  "author": "Imam Abd Allah ibn Alawi al-Haddad",
  "type": "wird",
  "sort_order": 22,
  "items": [
    { "surah": 112, "count": 3 },
    { "surah": 113, "count": 3 },
    { "surah": 114, "count": 3 },
    { "ayah": "23:97-98", "repeat_group": 1, "repeat_group_count": 3, "note": "The two verses are recited as a block, three times over." },
    { "ayah": "23:115-118" },
    { "ayah": "30:17-19" },
    { "dhikr": 5001 },
    { "ayah": "59:21" },
    { "ayah": "59:22-24" },
    { "ayah": "37:79-81" },
    { "dhikr": 3016, "count": 3 },
    { "dhikr": 2011 },
    { "dhikr": 5005 },
    { "dhikr": 5007 },
    { "dhikr": 5008 },
    { "dhikr": 5009 },
    { "dhikr": 5010 },
    { "dhikr": 3013 },
    { "dhikr": 5012 },
    { "dhikr": 5013 },
    { "dhikr": 3001 },
    { "dhikr": 5015 },
    { "dhikr": 5016 },
    { "dhikr": 5017 },
    { "dhikr": 5018 },
    { "dhikr": 5019 },
    { "dhikr": 5020 },
    { "dhikr": 5021 },
    { "dhikr": 5022 },
    { "dhikr": 5023 },
    { "dhikr": 5024 },
    { "dhikr": 5025 },
    { "dhikr": 5027 },
    { "dhikr": 5029 },
    { "dhikr": 5031 },
    { "dhikr": 5033 },
    { "dhikr": 5035 },
    { "dhikr": 5037 },
    { "dhikr": 3011 },
    { "dhikr": 5039 },
    { "dhikr": 5040 },
    { "dhikr": 5041 },
    { "dhikr": 5042 },
    { "dhikr": 5043 },
    { "dhikr": 5044 },
    { "dhikr": 5045 },
    { "dhikr": 5046 }
  ]
}
