{
  "id": 10,
  "name_arabic": "الْحِزْبُ الرَّابِعُ مِنَ الْأَحْزَابِ السَّبْعَةِ",
  "name_english": "Dala'il al-Khayrat — Part 4 (Thursday)",
  "author": "Imam Muhammad al-Jazuli",
  "type": "wird",
  "sort_order": 32,
  "series": {
    "name_english": "Dala'il al-Khayrat",
    "name_arabic": "دَلَائِلُ الْخَيْرَاتِ",
    "weekday": 4
  },
  "items": [
    {
      "dhikr": 13001
    },
    {
      "dhikr": 13002
    },
    {
      "dhikr": 13003
    },
    {
      "dhikr": 13004
    },
    {
      "dhikr": 13005
    },
    {
      "dhikr": 13006
    },
    {
      "dhikr": 13007
    },
    {
      "dhikr": 13008
    },
    {
      "dhikr": 13009
    },
    {
      "dhikr": 13010
    },
    {
      "dhikr": 13011
    },
    {
      "dhikr": 13012
    },
    {
      "dhikr": 13013
    },
    {
      "dhikr": 13014
    },
    {
      "dhikr": 13015
    },
    {
      "dhikr": 13016
    },
    {
      "dhikr": 13017
    },
    {
      "dhikr": 13018
    },
    {
      "dhikr": 13019
    },
    {
      "dhikr": 13020
    },
    {
      "dhikr": 13021
    },
    {
      "dhikr": 13022
    },
    {
      "dhikr": 13023
    },
    {
      "dhikr": 13024
    },
    {
      "dhikr": 13025
    },
    {
      "dhikr": 13026
    },
    {
      "dhikr": 13027
    },
    {
      "dhikr": 13028
    },
    {
      "dhikr": 13029
    },
    {
      "dhikr": 13030
    },
    {
      "dhikr": 13031
    },
    {
      "dhikr": 13032
    },
    {
      "dhikr": 13033,
      "note": "Beginning of the Third Quarter of the hizb."
    },
    {
      "dhikr": 13034
    },
    {
      "dhikr": 13035
    },
    {
      "dhikr": 13036
    },
    {
      "dhikr": 13037
    },
    {
      "dhikr": 13038
    },
    {
      "dhikr": 13039
    },
    {
      "dhikr": 13040
    },
    {
      "dhikr": 13041
    },
    {
      "dhikr": 13042
    },
    {
      "dhikr": 11016
    },
    {
      "dhikr": 13043
    },
    {
      "dhikr": 13044
    },
    {
      "dhikr": 13045
    }
  ]
}
