{
  "id": 12,
  "name_arabic": "الْحِزْبُ الْخَامِسُ مِنَ الْأَحْزَابِ السَّبْعَةِ",
  "name_english": "Dala'il al-Khayrat — Part 5 (Friday)",
  "author": "Imam Muhammad al-Jazuli",
  "type": "wird",
  "sort_order": 33,
  "series": {
    "name_english": "Dala'il al-Khayrat",
    "name_arabic": "دَلَائِلُ الْخَيْرَاتِ",
    "weekday": 5
  },
  "items": [
    {
      "dhikr": 14001
    },
    {
      "dhikr": 14002
    },
    {
      "dhikr": 14003
    },
    {
      "dhikr": 14004
    },
    {
      "dhikr": 14005
    },
    {
      "dhikr": 14006
    },
    {
      "dhikr": 14007
    },
    {
      "dhikr": 14008
    },
    {
      "dhikr": 14009
    },
    {
      "dhikr": 14010
    },
    {
      "dhikr": 14011
    },
    {
      "dhikr": 14012
    },
    {
      "dhikr": 14013
    },
    {
      "dhikr": 14014
    },
    {
      "dhikr": 14015
    },
    {
      "dhikr": 14016
    },
    {
      "dhikr": 14017
    },
    {
      "dhikr": 14018
    },
    {
      "dhikr": 14019
    },
    {
      "dhikr": 14020
    },
    {
      "dhikr": 14021
    },
    {
      "dhikr": 14022
    },
    {
      "dhikr": 14023
    },
    {
      "dhikr": 14024
    },
    {
      "dhikr": 14025
    },
    {
      "dhikr": 14026
    },
    {
      "dhikr": 14027
    },
    {
      "dhikr": 14028
    },
    {
      "dhikr": 14029
    },
    {
      "dhikr": 14030
    },
    {
      "dhikr": 14031
    },
    {
      "dhikr": 14032
    },
    {
      "dhikr": 14033
    },
    {
      "dhikr": 14034
    },
    {
      "dhikr": 14035
    },
    {
      "dhikr": 14036
    },
    {
      "dhikr": 14037
    },
    {
      "dhikr": 14038
    },
    {
      "dhikr": 14039
    },
    {
      "dhikr": 14040
    },
    {
      "dhikr": 14041
    },
    {
      "dhikr": 14042
    },
    {
      "dhikr": 14043
    },
    {
      "dhikr": 14044
    },
    {
      "dhikr": 14045
    },
    {
      "dhikr": 11136
    },
    {
      "dhikr": 14046
    },
    {
      "dhikr": 14047
    },
    {
      "dhikr": 14048
    },
    {
      "dhikr": 14049
    },
    {
      "dhikr": 14050
    }
  ]
}
